HUMAN-AI COMPARISON,SEARCH,,If I thought I knew what it was and it did not match the AI I searched to look for a match. If I did not know what it was I went with the AI
SEARCH,,,I would look at the image make a guess and search to see how my guess compared to the search.
SEARCH (BY AI LABEL),REPRESENTATIVE IMAGES,,i looked at the tree that the AI used and i compared that to what the picture actually was
SEARCH (BY AI LABEL),,,Some it was hard to tell what it was so I clicked AI to see heirarchy of the others
AI ADVICE 1ST & HUMAN CONFIRM 2ND,AI ADVICE WHEN HARD,,"I used the AI prediction to get me started and then went with my own thoughts, unless I had no idea, then I just went with the AI prediction, even if there was a low possibility of it being correct"
HUMAN-AI COMPARISON,,,"If the image was very similar to the AI image, I would choose the same answer. If not, I just use my best judgement to decide what the image was."
UNINFORMATIVE,,,i tried matching up the images
AI ADVICE 1ST & HUMAN CONFIRM 2ND,HUMAN KNOWLEDGE,,"Heck I couldn't tell what most of those things were. I mostly relied on the AI but sometimes it just didn't seem right. In those cases I guessed, but often my guesses weren't in the tree, so I picked the closest thing"
HUMAN KNOWLEDGE,,,I just guessed
HUMAN KNOWLEDGE 1ST & AI ADVICE 2ND,,,I just picked what beastly described the look of what I was seeing and compared to ais answer
SEARCH (BY AI LABEL),,,"I picked up some of the main characteristics of the similarities that the AI generated response drew, and  ""categorized"" those (color, shape, size, etc.)"
HUMAN KNOWLEDGE 1ST & AI ADVICE 2ND,,,My strategy for identifying the correct label for each image is to try to identify the object myself without the AI. After checking to see if I can do it myself i'll look at the Ai's suggestion and make a more informed decision on what it is i'm looking at. Sometimes the AI would be totally off other times it would be spot on. I used the Ai as something to confirm with but not rely on it's predictions.
HUMAN KNOWLEDGE 1ST & AI ADVICE 2ND,AI ADVICE WHEN HARD,,"With the images, I first guessed on my own and compared my guess to the image I was trying to label. Then, I looked at the AI prediction and the path to see if it was a better fit than my guess. Sometimes, the image was so blurred that I decided I'd rather count on the AI than my own guess."
UNINFORMATIVE,,,
AI ADVICE 1ST & HUMAN CONFIRM 2ND,SEARCH,,i looked at the ai's prediction and then if it matched the image id go with what the ai said and if it didnt i would try to find a label for what looked closer to the picture
AI ADVICE 1ST & HUMAN CONFIRM 2ND,HUMAN-AI COMPARISON,,"i used the ai's predictions, but i also used my own judgement based off of what i knew."
SEARCH (BY AI LABEL),SEARCH (BY KEYWORD),,"If the suggestions seemed close, but possibly off I would look through related categories one-by-one to see if there was a closer match. I would use the search if it seemed totally off."
AI ADVICE 1ST & HUMAN CONFIRM 2ND,SEARCH (BY AI LABEL),,I looked and thought in my mind what it could be and sometimes used the AI path to help
AI ADVICE 1ST & HUMAN CONFIRM 2ND,SEARCH (BY AI LABEL),DRILLING DROWN (HIERARCHY),"I usually started with the AI prediction and checked the similar objects to see if there was a better match, i.e. if I could tell a dog was a hound but wasn't sure the AI predicted the correct breed then I would look at images of the other breeds for a closer match. Some things I couldn't tell what it was at all in the image. For those, I tried exploring categories in the tree that I thought it might be, but a few of the images were too blurry or obscured to tell what it was at all. For those, I just went with the AI prediction because I could be looking forever without any certainty I would ever find the right match."
UNINFORMATIVE,,,
HUMAN KNOWLEDGE 1ST & AI ADVICE 2ND,AI ADVICE WHEN HARD,SEARCH,"If what I thought the image was matched what the AI thought it was, I treated it like a confirmation. If I had no idea what the image could be, I just went with what the AI thought. If I disagreed with the AI's identification, I tried to search for the closest answer."
SEARCH (BY AI LABEL),,,"If I felt that the image was close but not correct, I used the classifier prediction to help narrow down the selections. Some of the images were blurry so they were hard to figure out so I tried to rely on the AI Accuracy rating to help my confidence in choosing the correct one."
SEARCH,TRUST AI PREDICTION(S),,"I looked to see if there was anything similar before I made my final choice. Unless, of course, I knew right away the AI was correct."
SEARCH (BY AI LABEL),,,"When I clicked on the image to see all the suggestions a picture would match the one, I was guessing at."
SEARCH (BY AI LABEL),,,It was difficult to identify the images presented. Using the AI was helpful sometimes just that the list was so long to chose from.
HUMAN-AI COMPARISON,SEARCH (BY AI LABEL),,The AI was either clearly correct or wrong for the most part. For a few images there was a useful ambiguity to its predictions that allowed me to guess.
TRUST AI PREDICTION(S),SEARCH,,"I agreed with AI on some instantly, with others I looked a few things up to see if they were a better match or not."
AI ADVICE 1ST & HUMAN CONFIRM 2ND,AI ADVICE WHEN HARD,SEARCH (BY AI LABEL),Started with AI label. Some seemed obviously correct. Ones I disagreed with I looked for a label that fit better. One picture looked like a mosquito but there is no such thing in your labels that I could find. Only mosquito netting. So I went with the AI but pretty sure that was wrong.
AI ADVICE 1ST & HUMAN CONFIRM 2ND,SEARCH,,"I studied the image intensely, then compared to AI prediction. If it didn't come close, I search for what I though it could be."
SEARCH (BY AI LABEL),,,I chose based on the prediction of Ai and search engine.
TRUST AI PREDICTION(S),,,I mostly used the AI classifiers prediction to identify the correct label
SEARCH (BY AI LABEL),,,"I clicked on the image provided towards my far right and different option came up and when I clicked on the options, I saw the images and I used the options to identify the correct one"
AI ADVICE 1ST & HUMAN CONFIRM 2ND,REPRESENTATIVE IMAGES,,I took the AI predictor into consideration and sometimes looked up there prediction to get a better idea of what those images looked like. In cases where it did not look correct I drew on my own knowledge and then explored on Google to see if my idea could be correct.
AI ADVICE 1ST & HUMAN CONFIRM 2ND,TRUST AI PREDICTION(S),,"The AI's predictions were helpful as some images were very blurry.  Some images could also be classified in multiple ways such as car, taxi, and vehicle...so it was helpful that AI images narrowed some of the selections down."
UNINFORMATIVE,,,
REPRESENTATIVE IMAGES,SEARCH (HIERARCHY NETWORK),,A combination of visual studying and narrowing down options based on the choices provided
SEARCH (BY AI LABEL),SEARCH (BY KEYWORD),,I started with the AI hierarchy tree (except for a couple where the ai was obviously wrong) which often verified the ai was correct. If still unsure I searched out from there within the hierarchy.  If still unsure I searched on my best guess. There were a couple where the Ai seemed clearly wrong and I used the search function with what i thought the image was.
HUMAN-AI COMPARISON,SEARCH,,"I tried my best to find what I thought it was when I knew the AI to be wrong but had a difficult time find ing the correct object in the lists. I would start with what the AI said and then check the other kinds of dogs for instance to find the right one, then I would go backward or start over with my own keyword,"
HUMAN KNOWLEDGE 1ST & AI ADVICE 2ND,HUMAN-AI COMPARISON,TRUST AI PREDICTION(S),"I first tried to guess the image myself. Then I referred to the AI. If the AI agreed, I went with it. If the AI disagreed, I reevaluated my own guess. If I was clueless, I just went with the AI."
HUMAN KNOWLEDGE 1ST & AI ADVICE 2ND,HUMAN-AI COMPARISON,SEARCH,"First, I looked at the image without looking at the AI prediction to make a guess for myself. Secondly, I looked at the AI prediction. Third, I looked at the AI prediction's percentage. Finally, if I was sure I agreed, I typed in the label. If not, I pulled up the tree to get an idea of the AI's path and tried to find a match."
AI ADVICE 1ST & HUMAN CONFIRM 2ND,SEARCH (BY KEYWORD),TRUST AI (RANKING OR CONFIDENCE),"I basically looked at AI's prediction and paid attention to the % match. I compared AI's pic to my pic. If I thought they were correct, I agreed. If I thought they were close, I checked AI's answer and packed up on the chart an answer or two. If I thought they were way off, I used keywords and did my own search to narrow down.
"
AI ADVICE 1ST & HUMAN CONFIRM 2ND,TRUST AI PREDICTION(S),,"Some of the images were hard to even identify so I had to guess at those. Some of the images that the AI predicted, I checked first to see if they were right. Some I just trusted the AI."
SEARCH,REPRESENTATIVE IMAGES,TRUST AI PREDICTION(S),"I tried to identify the images the best I could. I expanded them, and anything I thought looked similar to the image I searched to see if the label existed - which made it basically guaranteed it was correct.  Most of the time, the image was so distorted had to trust the AI."
REPRESENTATIVE IMAGES,,,Sometimes especially with animals I looked at other similar ones in the category to see if there was a better fit.
HUMAN KNOWLEDGE 1ST & AI ADVICE 2ND,AI ADVICE WHEN HARD,,"I tried to figure it out myself first. If I knew for sure what it was, I went with that. If I thought I knew but wasn't completely sure, I checked against the AI. If I had no idea at all, I used the AI."
SEARCH BY AI LABEL,,,clicked ai prediction and select appropriate option.
HUMAN KNOWLEDGE 1ST & AI ADVICE 2ND,,,My strategy was to rely on the AI predictions when I wasn't sure what I was looking at. Otherwise I relied on what i thought it was
HUMAN-AI COMPARISON,TRUST AI (RANKING OR CONFIDENCE),,"If the AI's prediction was quite low, I would try to search for the image myself. If I could clearly identify the image, then I would rely on my own thinking and confirm if it matched with the AI's decision. If the AI's confidence was high and I agreed with the decision, I went with what the AI classified the image as."
HUMAN KNOWLEDGE 1ST & AI ADVICE 2ND,REPRESENTATIVE IMAGES,,If I know what it was I automatically I answered it by myself. I then clicked on the classifier and looked at various pictures to narrow it down.
AI ADVICE 1ST & HUMAN CONFIRM 2ND,,,"I would look at picture and if they matched then I would pick the animals, items in the AI picture and then click the corresponding animal or item and click the appropriate name of it.  Sometimes it was completely non useful as it didn't say what the image was when it it wasn't the exact animal or item. I thought I knew my animals haha but I only got 5.25 so I only got 5 extra which isn't to bad but I thought I would do better"
AI ADVICE 1ST & HUMAN CONFIRM 2ND,HUMAN-AI COMPARISON,,"First, I tried to identify the object in the image myself. Next, I consulted the predict of the AI. If I am confident my assessment of the image between my own judgment and the AI's recommendation, I proceed. If I am unsure or the AI disagrees, I would review other reference images in the category trees to try and find distinguishing attributes of the different options to make an educated guess on whether to accept the AI's recommendation or choose a similar category."
SEARCH BY AI LABEL,,,I used the AI to look at the other options to make sure that it was showing the correct choice.
HUMAN KNOWLEDGE 1ST & AI ADVICE 2ND,,,"I examined both images well before using the AI's predictor. If I knew it was not the right name for the image, I used the other image's predictor or just typed it in. Most of the time, I used the AI's predictor."